{
  "eventId": "019bd6c1-5555-7f2a-9c3d-5e7f8a9b0c1d",
  "occurredAt": "2026-09-13T09:15:00.0000000+00:00",
  "aggregateId": "019bd6c1-2222-7f2a-9c3d-5e7f8a9b0c1d",
  "organisationId": "019bcf7f-9d10-7b21-84c6-5e7f8a9b0c1d",
  "branchId": "019bcf7f-a204-7f38-9c52-6d7e8f90a1b2",
  "orderId": "019bd6c1-3333-7f2a-9c3d-5e7f8a9b0c1d",
  "consumedBy": "019bd6c1-6666-7f2a-9c3d-5e7f8a9b0c1d",
  "eventType": "billing.dispatch-exception-consumed.v1",
  "schemaVersion": 1
}
